15:49:38.129635 IP 192.168.1.186.63755 > 192.168.1.255.8181: UDP, length 68
15:49:38.145106 IP 192.168.1.186.63755 > 192.168.1.255.8181: UDP, length 68
15:49:38.347774 ARP, Request who-has 192.168.1.90 tell 192.168.1.1, length 46
15:49:39.136078 IP 192.168.1.186.63755 > 192.168.1.255.8181: UDP, length 68
15:49:39.151964 IP 192.168.1.186.63755 > 192.168.1.255.8181: UDP, length 68
15:49:39.371945 ARP, Request who-has 192.168.1.100 tell 192.168.1.1, length 46
15:49:40.144493 IP 192.168.1.186.63755 > 192.168.1.255.8181: UDP, length 68
15:49:40.160333 IP 192.168.1.186.63755 > 192.168.1.255.8181: UDP, length 68
15:49:41.151823 IP 192.168.1.186.63755 > 192.168.1.255.8181: UDP, length 68
15:49:41.167626 IP 192.168.1.186.63755 > 192.168.1.255.8181: UDP, length 68
15:49:42.165868 IP 192.168.1.186.63755 > 192.168.1.255.8181: UDP, length 68
15:49:42.181669 IP 192.168.1.186.63755 > 192.168.1.255.8181: UDP, length 68
15:49:43.174774 IP 192.168.1.186.63755 > 192.168.1.255.8181: UDP, length 68
15:49:43.190143 IP 192.168.1.186.63755 > 192.168.1.255.8181: UDP, length 68
15:49:44.188789 IP 192.168.1.186.63755 > 192.168.1.255.8181: UDP, length 68
15:49:44.203020 IP 192.168.1.186.63755 > 192.168.1.255.8181: UDP, length 68
15:49:45.200857 IP 192.168.1.186.63755 > 192.168.1.255.8181: UDP, length 68
15:49:45.216615 IP 192.168.1.186.63755 > 192.168.1.255.8181: UDP, length 68
15:49:46.213486 IP 192.168.1.186.63755 > 192.168.1.255.8181: UDP, length 68
15:49:46.229854 IP 192.168.1.186.63755 > 192.168.1.255.8181: UDP, length 68
15:49:47.224734 IP 192.168.1.186.63755 > 192.168.1.255.8181: UDP, length 68
15:49:47.240397 IP 192.168.1.186.63755 > 192.168.1.255.8181: UDP, length 68
15:49:48.076568 ARP, Request who-has 192.168.1.91 tell 192.168.1.1, length 46
15:49:48.235766 IP 192.168.1.186.63755 > 192.168.1.255.8181: UDP, length 68
15:49:48.250509 IP 192.168.1.186.63755 > 192.168.1.255.8181: UDP, length 68
15:49:49.245810 IP 192.168.1.186.63755 > 192.168.1.255.8181: UDP, length 68
15:49:49.261792 IP 192.168.1.186.63755 > 192.168.1.255.8181: UDP, length 68
15:49:50.260195 IP 192.168.1.186.63755 > 192.168.1.255.8181: UDP, length 68
15:49:50.276137 IP 192.168.1.186.63755 > 192.168.1.255.8181: UDP, length 68
15:49:51.273321 IP 192.168.1.186.63755 > 192.168.1.255.8181: UDP, length 68
15:49:51.289037 IP 192.168.1.186.63755 > 192.168.1.255.8181: UDP, length 68
15:49:51.660749 ARP, Request who-has 192.168.1.2 tell 192.168.1.1, length 46
15:49:52.095806 IP 192.168.1.186 > 239.255.255.250: igmp v2 report 239.255.255.250
15:49:52.285095 IP 192.168.1.186.63755 > 192.168.1.255.8181: UDP, length 68
15:49:52.300706 IP 192.168.1.186.63755 > 192.168.1.255.8181: UDP, length 68
15:49:52.684775 ARP, Request who-has 192.168.1.140 tell 192.168.1.1, length 46
15:49:52.685042 ARP, Request who-has 192.168.1.235 tell 192.168.1.1, length 46
15:49:53.092628 IP 192.168.1.186 > 224.0.0.252: igmp v2 report 224.0.0.252
15:49:53.298766 IP 192.168.1.186.63755 > 192.168.1.255.8181: UDP, length 68
15:49:53.314415 IP 192.168.1.186.63755 > 192.168.1.255.8181: UDP, length 68
15:49:53.597958 IP 192.168.1.186 > 224.0.0.251: igmp v2 report 224.0.0.251
15:49:54.306490 IP 192.168.1.186.63755 > 192.168.1.255.8181: UDP, length 68
15:49:54.322652 IP 192.168.1.186.63755 > 192.168.1.255.8181: UDP, length 68
15:49:54.733637 ARP, Request who-has 192.168.1.140 tell 192.168.1.1, length 46
15:49:54.733643 ARP, Request who-has 192.168.1.235 tell 192.168.1.1, length 46
15:49:55.319220 IP 192.168.1.186.63755 > 192.168.1.255.8181: UDP, length 68
15:49:55.335154 IP 192.168.1.186.63755 > 192.168.1.255.8181: UDP, length 68
15:49:56.268993 ARP, Request who-has 192.168.1.90 tell 192.168.1.90, length 46
15:49:56.326626 IP 192.168.1.186.63755 > 192.168.1.255.8181: UDP, length 68
15:49:56.342500 IP 192.168.1.186.63755 > 192.168.1.255.8181: UDP, length 68
15:49:56.678641 ARP, Request who-has 192.168.1.140 tell 192.168.1.1, length 46
15:49:56.678645 ARP, Request who-has 192.168.1.235 tell 192.168.1.1, length 46
15:49:57.336892 IP 192.168.1.186.63755 > 192.168.1.255.8181: UDP, length 68
15:49:57.351670 IP 192.168.1.186.63755 > 192.168.1.255.8181: UDP, length 68
15:49:58.345847 IP 192.168.1.186.63755 > 192.168.1.255.8181: UDP, length 68
15:49:58.361847 IP 192.168.1.186.63755 > 192.168.1.255.8181: UDP, length 68
15:49:58.726623 ARP, Request who-has 192.168.1.140 tell 192.168.1.1, length 46
15:49:59.361919 IP 192.168.1.186.63755 > 192.168.1.255.8181: UDP, length 68
15:49:59.377330 IP 192.168.1.186.63755 > 192.168.1.255.8181: UDP, length 68
15:50:00.370512 IP 192.168.1.186.63755 > 192.168.1.255.8181: UDP, length 68
15:50:00.385553 IP 192.168.1.186.63755 > 192.168.1.255.8181: UDP, length 68
15:50:00.774915 ARP, Request who-has 192.168.1.140 tell 192.168.1.1, length 46
15:50:00.774920 ARP, Request who-has 192.168.1.186 tell 192.168.1.1, length 46
15:50:01.383601 IP 192.168.1.186.63755 > 192.168.1.255.8181: UDP, length 68
15:50:01.399427 IP 192.168.1.186.63755 > 192.168.1.255.8181: UDP, length 68
15:50:02.392294 IP 192.168.1.186.63755 > 192.168.1.255.8181: UDP, length 68
15:50:02.407052 IP 192.168.1.186.63755 > 192.168.1.255.8181: UDP, length 68
15:50:02.925292 ARP, Request who-has 192.168.1.188 tell 192.168.1.1, length 46
15:50:03.402933 IP 192.168.1.186.63755 > 192.168.1.255.8181: UDP, length 68
15:50:03.418401 IP 192.168.1.186.63755 > 192.168.1.255.8181: UDP, length 68
15:50:03.744643 ARP, Request who-has 192.168.1.208 tell 192.168.1.208, length 46
15:50:04.412709 IP 192.168.1.186.63755 > 192.168.1.255.8181: UDP, length 68
15:50:04.428505 IP 192.168.1.186.63755 > 192.168.1.255.8181: UDP, length 68
15:50:04.973411 ARP, Request who-has 192.168.1.188 tell 192.168.1.1, length 46
15:50:05.420895 IP 192.168.1.186.63755 > 192.168.1.255.8181: UDP, length 68
15:50:05.436678 IP 192.168.1.186.63755 > 192.168.1.255.8181: UDP, length 68
15:50:06.431507 IP 192.168.1.186.63755 > 192.168.1.255.8181: UDP, length 68
15:50:06.446870 IP 192.168.1.186.63755 > 192.168.1.255.8181: UDP, length 68
15:50:06.919549 ARP, Request who-has 192.168.1.188 tell 192.168.1.1, length 46
15:50:07.442258 IP 192.168.1.186.63755 > 192.168.1.255.8181: UDP, length 68
15:50:07.457711 IP 192.168.1.186.63755 > 192.168.1.255.8181: UDP, length 68
15:50:08.452647 IP 192.168.1.186.63755 > 192.168.1.255.8181: UDP, length 68
15:50:08.467738 IP 192.168.1.186.63755 > 192.168.1.255.8181: UDP, length 68
15:50:08.967474 ARP, Request who-has 192.168.1.110 tell 192.168.1.1, length 46
15:50:08.967479 ARP, Request who-has 192.168.1.188 tell 192.168.1.1, length 46
15:50:09.461861 IP 192.168.1.186.63755 > 192.168.1.255.8181: UDP, length 68
15:50:09.477090 IP 192.168.1.186.63755 > 192.168.1.255.8181: UDP, length 68
15:50:10.470237 IP 192.168.1.186.63755 > 192.168.1.255.8181: UDP, length 68
15:50:10.485450 IP 192.168.1.186.63755 > 192.168.1.255.8181: UDP, length 68
15:50:10.913119 IP6 fe80::22b0:1ff:fef0:9ee6 > ff02::1: ICMP6, router advertisement, length 88
15:50:11.015386 ARP, Request who-has 192.168.1.188 tell 192.168.1.1, length 46
15:50:11.479084 IP 192.168.1.186.63755 > 192.168.1.255.8181: UDP, length 68
15:50:11.494181 IP 192.168.1.186.63755 > 192.168.1.255.8181: UDP, length 68
15:50:11.936927 ARP, Request who-has 192.168.1.106 tell 192.168.1.1, length 46
15:50:11.937186 ARP, Request who-has 192.168.1.208 tell 192.168.1.1, length 46
15:50:12.494606 IP 192.168.1.186.63755 > 192.168.1.255.8181: UDP, length 68
15:50:12.510908 IP 192.168.1.186.63755 > 192.168.1.255.8181: UDP, length 68
15:50:12.961126 ARP, Request who-has 192.168.1.90 tell 192.168.1.1, length 46
15:50:13.508247 IP 192.168.1.186.63755 > 192.168.1.255.8181: UDP, length 68
15:50:13.523857 IP 192.168.1.186.63755 > 192.168.1.255.8181: UDP, length 68
15:50:13.985065 ARP, Request who-has 192.168.1.100 tell 192.168.1.1, length 46
15:50:14.514892 IP 192.168.1.186.63755 > 192.168.1.255.8181: UDP, length 68
15:50:14.530277 IP 192.168.1.186.63755 > 192.168.1.255.8181: UDP, length 68
15:50:15.526952 IP 192.168.1.186.63755 > 192.168.1.255.8181: UDP, length 68
15:50:15.542664 IP 192.168.1.186.63755 > 192.168.1.255.8181: UDP, length 68
15:50:16.539751 IP 192.168.1.186.63755 > 192.168.1.255.8181: UDP, length 68
15:50:16.555500 IP 192.168.1.186.63755 > 192.168.1.255.8181: UDP, length 68
15:50:17.551655 IP 192.168.1.186.63755 > 192.168.1.255.8181: UDP, length 68
15:50:17.567372 IP 192.168.1.186.63755 > 192.168.1.255.8181: UDP, length 68
15:50:18.559798 IP 192.168.1.186.63755 > 192.168.1.255.8181: UDP, length 68
15:50:18.574900 IP 192.168.1.186.63755 > 192.168.1.255.8181: UDP, length 68
15:50:19.565585 IP 192.168.1.186.63755 > 192.168.1.255.8181: UDP, length 68
15:50:19.581402 IP 192.168.1.186.63755 > 192.168.1.255.8181: UDP, length 68
15:50:20.573567 IP 192.168.1.186.63755 > 192.168.1.255.8181: UDP, length 68
15:50:20.589674 IP 192.168.1.186.63755 > 192.168.1.255.8181: UDP, length 68
15:50:21.582224 IP 192.168.1.186.63755 > 192.168.1.255.8181: UDP, length 68
15:50:21.597831 IP 192.168.1.186.63755 > 192.168.1.255.8181: UDP, length 68
15:50:22.584031 IP 192.168.1.186.63755 > 192.168.1.255.8181: UDP, length 68
15:50:22.599621 IP 192.168.1.186.63755 > 192.168.1.255.8181: UDP, length 68
15:50:23.406524 ARP, Request who-has 192.168.1.91 tell 192.168.1.1, length 46
15:50:23.593600 IP 192.168.1.186.63755 > 192.168.1.255.8181: UDP, length 68
15:50:23.608921 IP 192.168.1.186.63755 > 192.168.1.255.8181: UDP, length 68
15:50:24.598172 IP 192.168.1.186.63755 > 192.168.1.255.8181: UDP, length 68
15:50:24.614123 IP 192.168.1.186.63755 > 192.168.1.255.8181: UDP, length 68
15:50:25.606291 IP 192.168.1.186.63755 > 192.168.1.255.8181: UDP, length 68
15:50:25.620469 IP 192.168.1.186.63755 > 192.168.1.255.8181: UDP, length 68
15:50:26.614063 IP 192.168.1.186.63755 > 192.168.1.255.8181: UDP, length 68
15:50:26.628598 IP 192.168.1.186.63755 > 192.168.1.255.8181: UDP, length 68
15:50:26.888122 ARP, Request who-has 192.168.1.2 tell 192.168.1.1, length 46
15:50:27.623659 IP 192.168.1.186.63755 > 192.168.1.255.8181: UDP, length 68
15:50:27.638646 IP 192.168.1.186.63755 > 192.168.1.255.8181: UDP, length 68
15:50:28.626091 IP 192.168.1.186.63755 > 192.168.1.255.8181: UDP, length 68
15:50:28.641302 IP 192.168.1.186.63755 > 192.168.1.255.8181: UDP, length 68
15:50:29.636588 IP 192.168.1.186.63755 > 192.168.1.255.8181: UDP, length 68
15:50:29.652459 IP 192.168.1.186.63755 > 192.168.1.255.8181: UDP, length 68
15:50:30.650116 IP 192.168.1.186.63755 > 192.168.1.255.8181: UDP, length 68
15:50:30.665907 IP 192.168.1.186.63755 > 192.168.1.255.8181: UDP, length 68
15:50:31.663824 IP 192.168.1.186.63755 > 192.168.1.255.8181: UDP, length 68
15:50:31.679480 IP 192.168.1.186.63755 > 192.168.1.255.8181: UDP, length 68
15:50:32.008440 ARP, Request who-has 192.168.1.235 tell 192.168.1.1, length 46
15:50:32.674170 IP 192.168.1.186.63755 > 192.168.1.255.8181: UDP, length 68
15:50:32.690036 IP 192.168.1.186.63755 > 192.168.1.255.8181: UDP, length 68
15:50:33.134932 ARP, Request who-has 192.168.1.106 tell 192.168.1.106, length 46
15:50:33.688168 IP 192.168.1.186.63755 > 192.168.1.255.8181: UDP, length 68
15:50:33.703959 IP 192.168.1.186.63755 > 192.168.1.255.8181: UDP, length 68
15:50:33.954160 ARP, Request who-has 192.168.1.235 tell 192.168.1.1, length 46
15:50:34.695091 IP 192.168.1.186.63755 > 192.168.1.255.8181: UDP, length 68
15:50:34.709956 IP 192.168.1.186.63755 > 192.168.1.255.8181: UDP, length 68
15:50:35.697788 IP 192.168.1.186.63755 > 192.168.1.255.8181: UDP, length 68
15:50:35.713580 IP 192.168.1.186.63755 > 192.168.1.255.8181: UDP, length 68
15:50:36.002331 ARP, Request who-has 192.168.1.186 tell 192.168.1.1, length 46
15:50:36.002338 ARP, Request who-has 192.168.1.235 tell 192.168.1.1, length 46
15:50:36.700412 IP 192.168.1.186.63755 > 192.168.1.255.8181: UDP, length 68
15:50:36.716490 IP 192.168.1.186.63755 > 192.168.1.255.8181: UDP, length 68
15:50:37.705187 IP 192.168.1.186.63755 > 192.168.1.255.8181: UDP, length 68
15:50:37.720808 IP 192.168.1.186.63755 > 192.168.1.255.8181: UDP, length 68
15:50:38.050271 ARP, Request who-has 192.168.1.235 tell 192.168.1.1, length 46
15:50:38.708618 IP 192.168.1.186.63755 > 192.168.1.255.8181: UDP, length 68
15:50:38.723924 IP 192.168.1.186.63755 > 192.168.1.255.8181: UDP, length 68
15:50:39.714365 IP 192.168.1.186.63755 > 192.168.1.255.8181: UDP, length 68
15:50:39.730065 IP 192.168.1.186.63755 > 192.168.1.255.8181: UDP, length 68
15:50:39.997371 ARP, Request who-has 192.168.1.235 tell 192.168.1.1, length 46
15:50:40.724364 IP 192.168.1.186.63755 > 192.168.1.255.8181: UDP, length 68
15:50:40.740328 IP 192.168.1.186.63755 > 192.168.1.255.8181: UDP, length 68
15:50:41.730220 IP 192.168.1.186.63755 > 192.168.1.255.8181: UDP, length 68
15:50:41.745717 IP 192.168.1.186.63755 > 192.168.1.255.8181: UDP, length 68
15:50:42.742852 IP 192.168.1.186.63755 > 192.168.1.255.8181: UDP, length 68
15:50:42.758913 IP 192.168.1.186.63755 > 192.168.1.255.8181: UDP, length 68
15:50:43.750105 IP 192.168.1.186.63755 > 192.168.1.255.8181: UDP, length 68
15:50:43.765429 IP 192.168.1.186.63755 > 192.168.1.255.8181: UDP, length 68
15:50:44.297055 ARP, Request who-has 192.168.1.110 tell 192.168.1.1, length 46
15:50:44.760349 IP 192.168.1.186.63755 > 192.168.1.255.8181: UDP, length 68
15:50:44.776236 IP 192.168.1.186.63755 > 192.168.1.255.8181: UDP, length 68
15:50:45.769757 IP 192.168.1.186.63755 > 192.168.1.255.8181: UDP, length 68
15:50:45.785191 IP 192.168.1.186.63755 > 192.168.1.255.8181: UDP, length 68
15:50:46.781840 IP 192.168.1.186.63755 > 192.168.1.255.8181: UDP, length 68
15:50:46.797177 IP 192.168.1.186.63755 > 192.168.1.255.8181: UDP, length 68
15:50:47.164324 ARP, Request who-has 192.168.1.106 tell 192.168.1.1, length 46
15:50:47.266878 ARP, Request who-has 192.168.1.208 tell 192.168.1.1, length 46
15:50:47.786711 IP 192.168.1.186.63755 > 192.168.1.255.8181: UDP, length 68
15:50:47.802627 IP 192.168.1.186.63755 > 192.168.1.255.8181: UDP, length 68
15:50:48.188482 ARP, Request who-has 192.168.1.90 tell 192.168.1.1, length 46
15:50:48.290964 IP6 fe80::18b1:95aa:5927:ec5d > ff02::16: HBH ICMP6, multicast listener report v2, 1 group record(s), length 28
15:50:48.290975 IP 192.168.1.235 > 224.0.0.251: igmp v2 report 224.0.0.251
15:50:48.291347 IP6 fe80::18b1:95aa:5927:ec5d > ff02::16: HBH ICMP6, multicast listener report v2, 1 group record(s), length 28
15:50:48.291352 IP 192.168.1.235.5353 > 224.0.0.251.5353: 0 [4q] PTR (QU)? _companion-link._tcp.local. PTR (QU)? _rdlink._tcp.local. PTR (QU)? _hap._tcp.local. PTR (QU)? _hap._udp.local. (85)
15:50:48.292018 IP6 fe80::18b1:95aa:5927:ec5d.5353 > ff02::fb.5353: 0 [4q] PTR (QU)? _companion-link._tcp.local. PTR (QU)? _rdlink._tcp.local. PTR (QU)? _hap._tcp.local. PTR (QU)? _hap._udp.local. (85)
15:50:48.393334 ARP, Request who-has 192.168.1.235 tell 192.168.1.90, length 46
15:50:48.393338 ARP, Request who-has 192.168.1.235 tell 192.168.1.106, length 46
15:50:48.495625 ARP, Request who-has 192.168.1.235 tell 192.168.1.208, length 46
15:50:48.793605 IP 192.168.1.186.63755 > 192.168.1.255.8181: UDP, length 68
15:50:48.809010 IP 192.168.1.186.63755 > 192.168.1.255.8181: UDP, length 68
15:50:49.008959 IP6 fe80::10b8:58df:1349:3f6f > ff02::16: HBH ICMP6, multicast listener report v2, 1 group record(s), length 28
15:50:49.008967 IP6 fe80::10b8:58df:1349:3f6f.5353 > ff02::fb.5353: 0 [4q] PTR (QU)? _hap._tcp.local. PTR (QU)? _rdlink._tcp.local. PTR (QU)? _companion-link._tcp.local. PTR (QU)? _hap._udp.local. (85)
15:50:49.008975 IP 192.168.1.140 > 224.0.0.2: igmp leave 224.0.0.251
15:50:49.008980 IP 192.168.1.140 > 224.0.0.251: igmp v2 report 224.0.0.251
15:50:49.008982 IP 192.168.1.140.5353 > 224.0.0.251.5353: 0 [4q] PTR (QU)? _hap._tcp.local. PTR (QU)? _rdlink._tcp.local. PTR (QU)? _companion-link._tcp.local. PTR (QU)? _hap._udp.local. (85)
15:50:49.109987 ARP, Request who-has 192.168.1.140 tell 192.168.1.208, length 46
15:50:49.212450 ARP, Request who-has 192.168.1.140 tell 192.168.1.90, length 46
15:50:49.212543 ARP, Request who-has 192.168.1.140 tell 192.168.1.106, length 46
15:50:49.212652 ARP, Request who-has 192.168.1.100 tell 192.168.1.1, length 46
15:50:49.213009 ARP, Request who-has 192.168.1.140 tell 192.168.1.90, length 46
15:50:49.315146 IP 192.168.1.235.5353 > 224.0.0.251.5353: 0 [3a] [4q] PTR (QM)? _companion-link._tcp.local. PTR (QM)? _rdlink._tcp.local. PTR (QM)? _hap._tcp.local. PTR (QM)? _hap._udp.local. (183)
15:50:49.315434 IP6 fe80::18b1:95aa:5927:ec5d.5353 > ff02::fb.5353: 0 [3a] [4q] PTR (QM)? _companion-link._tcp.local. PTR (QM)? _rdlink._tcp.local. PTR (QM)? _hap._tcp.local. PTR (QM)? _hap._udp.local. (183)
15:50:49.724805 IP6 fe80::18b1:95aa:5927:ec5d > ff02::16: HBH ICMP6, multicast listener report v2, 1 group record(s), length 28
15:50:49.805224 IP 192.168.1.186.63755 > 192.168.1.255.8181: UDP, length 68
15:50:49.820916 IP 192.168.1.186.63755 > 192.168.1.255.8181: UDP, length 68
15:50:50.134178 IP6 fe80::10b8:58df:1349:3f6f > ff02::16: HBH ICMP6, multicast listener report v2, 1 group record(s), length 28
15:50:50.817439 IP 192.168.1.186.63755 > 192.168.1.255.8181: UDP, length 68
15:50:50.832275 IP 192.168.1.186.63755 > 192.168.1.255.8181: UDP, length 68
15:50:51.834331 IP 192.168.1.186.63755 > 192.168.1.255.8181: UDP, length 68
15:50:51.834339 IP 192.168.1.186.63755 > 192.168.1.255.8181: UDP, length 68
15:50:52.284877 IP 192.168.1.235.5353 > 224.0.0.251.5353: 0 [3a] [4q] PTR (QM)? _companion-link._tcp.local. PTR (QM)? _rdlink._tcp.local. PTR (QM)? _hap._tcp.local. PTR (QM)? _hap._udp.local. (183)
15:50:52.285150 IP6 fe80::18b1:95aa:5927:ec5d.5353 > ff02::fb.5353: 0 [3a] [4q] PTR (QM)? _companion-link._tcp.local. PTR (QM)? _rdlink._tcp.local. PTR (QM)? _hap._tcp.local. PTR (QM)? _hap._udp.local. (183)
15:50:52.834895 IP 192.168.1.186.63755 > 192.168.1.255.8181: UDP, length 68
15:50:52.834901 IP 192.168.1.186.63755 > 192.168.1.255.8181: UDP, length 68
15:50:53.848707 IP 192.168.1.186.63755 > 192.168.1.255.8181: UDP, length 68
15:50:53.848718 IP 192.168.1.186.63755 > 192.168.1.255.8181: UDP, length 68
15:50:54.850222 IP 192.168.1.186.63755 > 192.168.1.255.8181: UDP, length 68
15:50:54.850234 IP 192.168.1.186.63755 > 192.168.1.255.8181: UDP, length 68
15:50:55.861477 IP 192.168.1.186.63755 > 192.168.1.255.8181: UDP, length 68
15:50:55.861495 IP 192.168.1.186.63755 > 192.168.1.255.8181: UDP, length 68
15:50:56.278341 ARP, Request who-has 192.168.1.90 tell 192.168.1.90, length 46
15:50:56.874485 IP 192.168.1.186.63755 > 192.168.1.255.8181: UDP, length 68
15:50:56.874492 IP 192.168.1.186.63755 > 192.168.1.255.8181: UDP, length 68
15:50:57.883357 IP 192.168.1.186.63755 > 192.168.1.255.8181: UDP, length 68
15:50:57.883671 IP 192.168.1.186.63755 > 192.168.1.255.8181: UDP, length 68
15:50:58.736997 ARP, Request who-has 192.168.1.91 tell 192.168.1.1, length 46
15:50:58.895143 IP 192.168.1.186.63755 > 192.168.1.255.8181: UDP, length 68
15:50:58.895254 IP 192.168.1.186.63755 > 192.168.1.255.8181: UDP, length 68
15:50:59.908272 IP 192.168.1.186.63755 > 192.168.1.255.8181: UDP, length 68
15:50:59.908280 IP 192.168.1.186.63755 > 192.168.1.255.8181: UDP, length 68
15:51:00.920545 IP 192.168.1.186.63755 > 192.168.1.255.8181: UDP, length 68
15:51:00.920555 IP 192.168.1.186.63755 > 192.168.1.255.8181: UDP, length 68
15:51:01.928246 IP 192.168.1.186.63755 > 192.168.1.255.8181: UDP, length 68
15:51:01.928254 IP 192.168.1.186.63755 > 192.168.1.255.8181: UDP, length 68
15:51:02.013600 ARP, Request who-has 192.168.1.2 tell 192.168.1.1, length 46
15:51:02.937837 IP 192.168.1.186.63755 > 192.168.1.255.8181: UDP, length 68
15:51:02.937843 IP 192.168.1.186.63755 > 192.168.1.255.8181: UDP, length 68
15:51:03.754802 ARP, Request who-has 192.168.1.208 tell 192.168.1.208, length 46
15:51:03.950268 IP 192.168.1.186.63755 > 192.168.1.255.8181: UDP, length 68
15:51:03.950277 IP 192.168.1.186.63755 > 192.168.1.255.8181: UDP, length 68
15:51:04.961828 IP 192.168.1.186.63755 > 192.168.1.255.8181: UDP, length 68
15:51:04.961833 IP 192.168.1.186.63755 > 192.168.1.255.8181: UDP, length 68
15:51:05.972411 IP 192.168.1.186.63755 > 192.168.1.255.8181: UDP, length 68
15:51:05.972416 IP 192.168.1.186.63755 > 192.168.1.255.8181: UDP, length 68
15:51:06.978039 IP 192.168.1.186.63755 > 192.168.1.255.8181: UDP, length 68
15:51:06.978046 IP 192.168.1.186.63755 > 192.168.1.255.8181: UDP, length 68
15:51:07.985382 IP 192.168.1.186.63755 > 192.168.1.255.8181: UDP, length 68
15:51:07.985391 IP 192.168.1.186.63755 > 192.168.1.255.8181: UDP, length 68
15:51:08.998437 IP 192.168.1.186.63755 > 192.168.1.255.8181: UDP, length 68
15:51:08.998446 IP 192.168.1.186.63755 > 192.168.1.255.8181: UDP, length 68
15:51:10.010194 IP 192.168.1.186.63755 > 192.168.1.255.8181: UDP, length 68
15:51:10.010201 IP 192.168.1.186.63755 > 192.168.1.255.8181: UDP, length 68
15:51:11.015454 IP 192.168.1.186.63755 > 192.168.1.255.8181: UDP, length 68
15:51:11.015461 IP 192.168.1.186.63755 > 192.168.1.255.8181: UDP, length 68
15:51:11.229349 ARP, Request who-has 192.168.1.186 tell 192.168.1.1, length 46
15:51:12.030124 IP 192.168.1.186.63755 > 192.168.1.255.8181: UDP, length 68
15:51:12.030133 IP 192.168.1.186.63755 > 192.168.1.255.8181: UDP, length 68
15:51:13.034721 IP 192.168.1.186.63755 > 192.168.1.255.8181: UDP, length 68
15:51:13.034733 IP 192.168.1.186.63755 > 192.168.1.255.8181: UDP, length 68
15:51:14.039697 IP 192.168.1.186.63755 > 192.168.1.255.8181: UDP, length 68
15:51:14.039703 IP 192.168.1.186.63755 > 192.168.1.255.8181: UDP, length 68
15:51:15.049051 IP 192.168.1.186.63755 > 192.168.1.255.8181: UDP, length 68
15:51:15.049249 IP 192.168.1.186.63755 > 192.168.1.255.8181: UDP, length 68
15:51:15.224515 ARP, Request who-has 192.168.1.235 tell 192.168.1.1, length 46
15:51:16.053830 IP 192.168.1.186.63755 > 192.168.1.255.8181: UDP, length 68
15:51:16.053837 IP 192.168.1.186.63755 > 192.168.1.255.8181: UDP, length 68
15:51:17.066128 IP 192.168.1.186.63755 > 192.168.1.255.8181: UDP, length 68
15:51:17.066133 IP 192.168.1.186.63755 > 192.168.1.255.8181: UDP, length 68
15:51:17.271247 ARP, Request who-has 192.168.1.235 tell 192.168.1.1, length 46
15:51:18.078426 IP 192.168.1.186.63755 > 192.168.1.255.8181: UDP, length 68
15:51:18.078514 IP 192.168.1.186.63755 > 192.168.1.255.8181: UDP, length 68
15:51:19.086555 IP 192.168.1.186.63755 > 192.168.1.255.8181: UDP, length 68
15:51:19.086568 IP 192.168.1.186.63755 > 192.168.1.255.8181: UDP, length 68
15:51:19.216883 ARP, Request who-has 192.168.1.110 tell 192.168.1.1, length 46
15:51:19.319421 ARP, Request who-has 192.168.1.235 tell 192.168.1.1, length 46
15:51:19.831361 IP 192.168.1.235 > 224.0.0.251: igmp v2 report 224.0.0.251
15:51:19.831461 IP 192.168.1.235.5353 > 224.0.0.251.5353: 0 [4q] PTR (QU)? _companion-link._tcp.local. PTR (QU)? _rdlink._tcp.local. PTR (QU)? _hap._tcp.local. PTR (QU)? _hap._udp.local. (85)
15:51:19.831742 IP6 fe80::18b1:95aa:5927:ec5d.5353 > ff02::fb.5353: 0 [4q] PTR (QU)? _companion-link._tcp.local. PTR (QU)? _rdlink._tcp.local. PTR (QU)? _hap._tcp.local. PTR (QU)? _hap._udp.local. (85)
15:51:19.933662 IP6 fe80::5ab6:23ff:fe09:dab0 > ff02::1:ff27:ec5d: ICMP6, neighbor solicitation, who has fe80::18b1:95aa:5927:ec5d, length 32
15:51:20.036622 IP6 fe80::ca5c:ccff:fe64:bde9 > ff02::1:ff27:ec5d: ICMP6, neighbor solicitation, who has fe80::18b1:95aa:5927:ec5d, length 32
15:51:20.036636 IP6 fe80::b660:edff:fe14:1742 > ff02::1:ff27:ec5d: ICMP6, neighbor solicitation, who has fe80::18b1:95aa:5927:ec5d, length 32
15:51:20.097507 IP 192.168.1.186.63755 > 192.168.1.255.8181: UDP, length 68
15:51:20.097698 IP 192.168.1.186.63755 > 192.168.1.255.8181: UDP, length 68
15:51:20.855672 IP 192.168.1.235.5353 > 224.0.0.251.5353: 0 [3a] [4q] PTR (QM)? _companion-link._tcp.local. PTR (QM)? _rdlink._tcp.local. PTR (QM)? _hap._tcp.local. PTR (QM)? _hap._udp.local. (183)
15:51:20.856161 IP6 fe80::18b1:95aa:5927:ec5d.5353 > ff02::fb.5353: 0 [3a] [4q] PTR (QM)? _companion-link._tcp.local. PTR (QM)? _rdlink._tcp.local. PTR (QM)? _hap._tcp.local. PTR (QM)? _hap._udp.local. (183)
15:51:21.105439 IP 192.168.1.186.63755 > 192.168.1.255.8181: UDP, length 68
15:51:21.105447 IP 192.168.1.186.63755 > 192.168.1.255.8181: UDP, length 68
15:51:21.162576 IP 192.168.1.140 > 224.0.0.2: igmp leave 224.0.0.251
15:51:21.162764 IP 192.168.1.140 > 224.0.0.251: igmp v2 report 224.0.0.251
15:51:21.162988 IP 192.168.1.140.5353 > 224.0.0.251.5353: 0 [4q] PTR (QU)? _hap._tcp.local. PTR (QU)? _rdlink._tcp.local. PTR (QU)? _companion-link._tcp.local. PTR (QU)? _hap._udp.local. (85)
15:51:21.163237 IP6 fe80::10b8:58df:1349:3f6f.5353 > ff02::fb.5353: 0 [4q] PTR (QU)? _hap._tcp.local. PTR (QU)? _rdlink._tcp.local. PTR (QU)? _companion-link._tcp.local. PTR (QU)? _hap._udp.local. (85)
15:51:22.084849 IP 192.168.1.140.5353 > 224.0.0.251.5353: 0 [3a] [4q] PTR (QM)? _hap._tcp.local. PTR (QM)? _rdlink._tcp.local. PTR (QM)? _companion-link._tcp.local. PTR (QM)? _hap._udp.local. (183)
15:51:22.084857 IP6 fe80::10b8:58df:1349:3f6f.5353 > ff02::fb.5353: 0 [3a] [4q] PTR (QM)? _hap._tcp.local. PTR (QM)? _rdlink._tcp.local. PTR (QM)? _companion-link._tcp.local. PTR (QM)? _hap._udp.local. (183)
15:51:22.116525 IP 192.168.1.186.63755 > 192.168.1.255.8181: UDP, length 68
15:51:22.116530 IP 192.168.1.186.63755 > 192.168.1.255.8181: UDP, length 68
15:51:22.391432 ARP, Request who-has 192.168.1.106 tell 192.168.1.1, length 46
15:51:22.391438 ARP, Request who-has 192.168.1.208 tell 192.168.1.1, length 46
15:51:23.132242 IP 192.168.1.186.63755 > 192.168.1.255.8181: UDP, length 68
15:51:23.132248 IP 192.168.1.186.63755 > 192.168.1.255.8181: UDP, length 68
15:51:23.415404 ARP, Request who-has 192.168.1.90 tell 192.168.1.1, length 46
15:51:24.138653 IP 192.168.1.186.63755 > 192.168.1.255.8181: UDP, length 68
15:51:24.138664 IP 192.168.1.186.63755 > 192.168.1.255.8181: UDP, length 68
15:51:25.139820 IP 192.168.1.186.63755 > 192.168.1.255.8181: UDP, length 68
15:51:25.140038 IP 192.168.1.186.63755 > 192.168.1.255.8181: UDP, length 68
15:51:26.147384 IP 192.168.1.186.63755 > 192.168.1.255.8181: UDP, length 68
15:51:26.147393 IP 192.168.1.186.63755 > 192.168.1.255.8181: UDP, length 68
15:51:27.152067 IP 192.168.1.186.63755 > 192.168.1.255.8181: UDP, length 68
15:51:27.152090 IP 192.168.1.186.63755 > 192.168.1.255.8181: UDP, length 68
15:51:28.159404 IP 192.168.1.186.63755 > 192.168.1.255.8181: UDP, length 68
15:51:28.159410 IP 192.168.1.186.63755 > 192.168.1.255.8181: UDP, length 68
15:51:29.167360 IP 192.168.1.186.63755 > 192.168.1.255.8181: UDP, length 68
15:51:29.167365 IP 192.168.1.186.63755 > 192.168.1.255.8181: UDP, length 68
15:51:30.173670 IP 192.168.1.186.63755 > 192.168.1.255.8181: UDP, length 68
15:51:30.173679 IP 192.168.1.186.63755 > 192.168.1.255.8181: UDP, length 68
15:51:31.181376 IP 192.168.1.186.63755 > 192.168.1.255.8181: UDP, length 68
15:51:31.181384 IP 192.168.1.186.63755 > 192.168.1.255.8181: UDP, length 68
15:51:31.710062 ARP, Request who-has 192.168.1.91 tell 192.168.1.1, length 46
15:51:32.196815 IP 192.168.1.186.63755 > 192.168.1.255.8181: UDP, length 68
15:51:32.196822 IP 192.168.1.186.63755 > 192.168.1.255.8181: UDP, length 68
15:51:33.144536 ARP, Request who-has 192.168.1.106 tell 192.168.1.106, length 46
15:51:33.204346 IP 192.168.1.186.63755 > 192.168.1.255.8181: UDP, length 68
15:51:33.204406 IP 192.168.1.186.63755 > 192.168.1.255.8181: UDP, length 68
15:51:34.217080 IP 192.168.1.186.63755 > 192.168.1.255.8181: UDP, length 68
15:51:34.217554 IP 192.168.1.186.63755 > 192.168.1.255.8181: UDP, length 68
15:51:35.089395 ARP, Request who-has 192.168.1.2 tell 192.168.1.1, length 46
15:51:35.219664 IP 192.168.1.186.63755 > 192.168.1.255.8181: UDP, length 68
15:51:35.219762 IP 192.168.1.186.63755 > 192.168.1.255.8181: UDP, length 68
15:51:36.232734 IP 192.168.1.186.63755 > 192.168.1.255.8181: UDP, length 68
15:51:36.232750 IP 192.168.1.186.63755 > 192.168.1.255.8181: UDP, length 68
15:51:37.241060 IP 192.168.1.186.63755 > 192.168.1.255.8181: UDP, length 68
15:51:37.241131 IP 192.168.1.186.63755 > 192.168.1.255.8181: UDP, length 68
15:51:38.251265 IP 192.168.1.186.63755 > 192.168.1.255.8181: UDP, length 68
15:51:38.251277 IP 192.168.1.186.63755 > 192.168.1.255.8181: UDP, length 68
15:51:39.260619 IP 192.168.1.186.63755 > 192.168.1.255.8181: UDP, length 68
15:51:39.260626 IP 192.168.1.186.63755 > 192.168.1.255.8181: UDP, length 68
15:51:40.276559 IP 192.168.1.186.63755 > 192.168.1.255.8181: UDP, length 68
15:51:40.276565 IP 192.168.1.186.63755 > 192.168.1.255.8181: UDP, length 68
15:51:41.284987 IP 192.168.1.186.63755 > 192.168.1.255.8181: UDP, length 68
15:51:41.284995 IP 192.168.1.186.63755 > 192.168.1.255.8181: UDP, length 68
15:51:42.294815 IP 192.168.1.186.63755 > 192.168.1.255.8181: UDP, length 68
15:51:42.294861 IP 192.168.1.186.63755 > 192.168.1.255.8181: UDP, length 68
15:51:43.304722 IP 192.168.1.186.63755 > 192.168.1.255.8181: UDP, length 68
15:51:43.304730 IP 192.168.1.186.63755 > 192.168.1.255.8181: UDP, length 68
15:51:44.306386 ARP, Request who-has 192.168.1.186 tell 192.168.1.1, length 46
15:51:44.315982 IP 192.168.1.186.63755 > 192.168.1.255.8181: UDP, length 68
15:51:44.315987 IP 192.168.1.186.63755 > 192.168.1.255.8181: UDP, length 68
15:51:45.327220 IP 192.168.1.186.63755 > 192.168.1.255.8181: UDP, length 68
15:51:45.327230 IP 192.168.1.186.63755 > 192.168.1.255.8181: UDP, length 68
15:51:46.335473 IP 192.168.1.186.63755 > 192.168.1.255.8181: UDP, length 68
15:51:46.335481 IP 192.168.1.186.63755 > 192.168.1.255.8181: UDP, length 68
15:51:47.350581 IP 192.168.1.186.63755 > 192.168.1.255.8181: UDP, length 68
15:51:47.350628 IP 192.168.1.186.63755 > 192.168.1.255.8181: UDP, length 68
15:51:48.360640 IP 192.168.1.186.63755 > 192.168.1.255.8181: UDP, length 68
15:51:48.360648 IP 192.168.1.186.63755 > 192.168.1.255.8181: UDP, length 68
15:51:49.373046 IP 192.168.1.186.63755 > 192.168.1.255.8181: UDP, length 68
15:51:49.373051 IP 192.168.1.186.63755 > 192.168.1.255.8181: UDP, length 68
15:51:50.380629 IP 192.168.1.186.63755 > 192.168.1.255.8181: UDP, length 68
15:51:50.380641 IP 192.168.1.186.63755 > 192.168.1.255.8181: UDP, length 68
